序号,篇名,作者,刊名,发表时间,被引,自引,外引,文献总数
2006,十九大科技强国背景下翻译硕士人才培养研究,张军；李蓓蓓；杨蕾；吕娜,英语广场,2019-06-13 17:09,2,0,2,2704
2008,众包翻译对中国跨文化传播的作用,蔡彩；刘铁祥；屈冬春,英语广场,2019-05-17 08:51,1,0,1,2704
2009,试论计算机辅助翻译软件与云翻译平台的对比――以Trados和译马网为例,吴婷；祁文慧,英语广场,2019-06-13 17:09,6,0,6,2704
2011,浅析翻译人才应具备的素质与培养对策,万学,英语广场,2019-06-13 17:09,0,0,0,2704
2012,英汉构词法对比探析,吴月凤；赵林静；秦莉萍,英语广场,2019-06-13 17:09,0,0,0,2704
2013,从文化差异透视影响中西方跨文化交际的因素,付娟娟,英语广场,2019-06-13 17:09,3,0,3,2704
2014,英语专业大一学生英语语音同伴反馈与教师反馈的实证对比研究,张迎春,英语广场,2019-06-13 17:09,0,0,0,2704
2015,基于自我决定理论的大学英语翻转课堂研究――依托A,陈春丽,英语广场,2019-06-13 17:09,3,0,3,2704
2016,基于网络课程的英语专业学生自主学习研究,吴叶紫,英语广场,2019-06-13 17:09,0,0,0,2704
2017,安徽省高校英文网站建设现状最新研究报告,罗林；黄创,英语广场,2019-06-13 17:09,0,0,0,2704
2018,简析网络环境下高职英语线上线下混合式教学实践,谭泉泉,英语广场,2019-06-13 17:09,7,0,7,2704
2019,民办应用型本科高校大学英语四级教学的反思性教学实践――以北京吉利学院为例,胡烨静；高运艳,英语广场,2019-06-13 17:09,2,0,2,2704
2020,微课在大学英语教学中的应用模式管窥,胡曦,英语广场,2019-06-13 17:09,2,0,2,2704
2021,基于文化内容的大学英语教材改革探究,岳美荣,英语广场,2019-06-13 17:09,1,0,1,2704
2022,从慕课的发展看其对高校英语教学的影响,岑嵩,英语广场,2019-06-13 17:09,0,0,0,2704
2024,文化顺应理论下《列子》中常见典故的翻译分析,郭杨伞；林静,英语广场,2019-05-17 08:51,0,0,0,2704
2025,产出导向法在高职大学英语教学中的应用,吴倩,英语广场,2019-05-17 08:51,4,0,4,2704
2026,大学英语教学多元评价体系的构建与完善,谢利君,英语广场,2019-05-17 08:51,4,0,4,2704
2027,大学英语教育中的跨文化交际能力培养策略,王琦,英语广场,2019-05-17 08:51,1,0,1,2704
2028,大数据背景下高校英语泛在学习资源平台建构,涂青青,英语广场,2019-05-17 08:51,6,0,6,2704
2029,基于智课平台的大学英语翻转课堂教学模式研究,王茹,英语广场,2019-05-17 08:51,2,0,2,2704
2030,高校英语教师教学技能发展的相关分析,赵娴,英语广场,2019-05-17 08:51,1,0,1,2704
2031,机考对于大学英语阅读考试成绩的影响分析,项靓,英语广场,2019-05-17 08:51,0,0,0,2704
2033,民办高校英语青年教师的专业化发展探析,郭漫；陈丽,英语广场,2019-05-17 08:51,2,0,2,2704
2034,《英语国家概况》课程问题引导教学模式的探索――基于建构主义学习理论,崔金媛；左宝霞,英语广场,2019-06-13 17:09,1,0,1,2704
2035,师专英语的分层次教学探讨,罗媛媛,英语广场,2019-06-13 17:09,0,0,0,2704
2036,“互联网+”背景下英语专业听力课程教学改革与实施,帅婷,英语广场,2019-06-13 17:09,4,0,4,2704
2037,任务驱动教学法在高职公共英语教学中的应用,李倩,英语广场,2019-06-13 17:09,4,0,4,2704
2039,高职英语教学中的人文素养渗透研究,张欣,英语广场,2019-06-13 17:09,0,0,0,2704
2040,过程体裁法在高职英语应用文写作教学中的有效性研究,马淑俊,英语广场,2019-06-13 17:09,6,0,6,2704
2041,EAP教学视域下大学英语课程教学改革实践研究,郑颖,英语广场,2019-06-13 17:09,0,0,0,2704
2042,职高生英语学习的有效性研究,凌春芳,英语广场,2019-06-13 17:09,2,0,2,2704
2044,高职英语信息化教学优化策略探析,黄玲；张桂华,英语广场,2019-06-13 17:09,1,0,1,2704
2045,简论新时期大学英语教学的发展路径,刘荣,英语广场,2019-06-13 17:09,1,0,1,2704
2046,能源企业网页特点及其英译技巧――以冀中能源集团为例,罗林；黄创,英语广场,2019-05-17 08:51,0,0,0,2704
2047,浅谈《三国志》中称谓文化术语的翻译策略,魏天昕,英语广场,2019-05-17 08:51,1,0,1,2704
2048,全人教育理念下的大学英语教学研究,李慧芬；吴得卿,英语广场,2019-05-17 08:51,2,0,2,2704
2049,产出导向法在独立学院大学英语教学中的应用,臧娜；李菁,英语广场,2019-05-17 08:51,2,0,2,2704
2050,商务英语专业学生批判性认知思维倾向现状的实证研究,蒋丽平,英语广场,2019-05-17 08:51,1,1,0,2704
2051,浅析学生为中心的实例型讨论式教学――以“广告翻译”为例,梁志芳,英语广场,2019-05-17 08:51,0,0,0,2704
2053,“互联网+”背景下大学英语翻转课堂教学问题与对策阐述,胡曦,英语广场,2019-05-17 08:51,8,0,8,2704
2055,大学英语课堂教学模式的调查研究,王梦杰,英语广场,2019-05-17 08:51,1,0,1,2704
2056,英语写作反馈中教师角色定位与构建,李珍；赵星,英语广场,2019-05-17 08:51,0,0,0,2704
2060,浅析小学高年级英语课堂教学中的提问技巧,廖惠平,英语广场,2019-05-17 08:51,9,0,9,2704
2061,欠发达地区小学英语课堂教学研究――基于Phonics教学法,廖英骐,英语广场,2019-05-17 08:51,0,0,0,2704
2062,论思维导图在初中英语话题写作复习课中的应用,汤艳平,英语广场,2019-05-17 08:51,4,0,4,2704
2064,元认知策略在大学英语听力教学中的应用研究,段金惠,英语广场,2019-06-13 17:09,6,0,6,2704
2065,写作能力教学策略在职业院校英语教学中的应用,程丹丹,英语广场,2019-06-13 17:09,1,0,1,2704
2066,O2O线上线下教学模式在大学英语教学中的应用及对策,张玉洁,英语广场,2019-06-13 17:09,10,0,10,2704
2067,翻转课堂视角下移动端对大学英语课堂的辅助作用,张豫,英语广场,2019-06-13 17:09,0,0,0,2704
2068,计算机辅助翻译技术在教学中的应用与效果分析――以《翻译理论与实践》课教学为例,张丽娜,英语广场,2019-06-13 17:09,1,0,1,2704
2070,浅析高职学生基础英语自主学习能力的培养,李仕敏,英语广场,2019-06-13 17:09,1,0,1,2704
2074,基于MOOC的翻转课堂教学模式在高职英语课程中的应用,刘露,英语广场,2019-06-13 17:09,2,0,2,2704
2075,高考英语完形填空校本学案开发与实践研究,戴秋兰,英语广场,2019-06-13 17:09,1,0,1,2704
2076,小学英语阅读教学中培养学生思维能力的探索,张艳芳,英语广场,2019-06-13 17:09,7,0,7,2704
2077,浅谈初中英语高效课堂的构建策略,黄加常,英语广场,2019-06-13 17:09,5,0,5,2704
2078,初中英语学困生的成因及转化对策,张利华,英语广场,2019-06-13 17:09,10,0,10,2704
2079,试论小学英语课堂人文教育,曹小红,英语广场,2019-06-13 17:09,0,0,0,2704
2080,英语核心素养之文化品格对英语学习的正迁移――以剑桥系列教材English in Mind Book 1的教学为例,杨茜,英语广场,2019-06-13 17:09,0,0,0,2704
2081,基于英语核心素养的农村高中英语读写实践与探究,徐鹏辉,英语广场,2019-06-13 17:09,2,0,2,2704
2082,高中英语阅读教学策略的思考探究,廖宽凤,英语广场,2019-06-13 17:09,12,0,12,2704
2083,浅谈“互联网+”教学模式在中职英语教学中的应用,郭雯,英语广场,2019-06-13 17:09,9,0,9,2704
2084,微课在高中英语语法教学新模式中的应用探讨,熊涌宏；周彦君,英语广场,2019-06-13 17:09,6,0,6,2704
2085,浅议如何在初一课堂实现英语的高效学习,钟银婵,英语广场,2019-06-13 17:09,0,0,0,2704
2086,浅议情感教学在高中英语阅读教学中的应用,黄莉莉,英语广场,2019-06-13 17:09,5,0,5,2704
2087,认知视角下的字幕翻译研究――以电影《芳华》为例,柯国轩；钱纪芳,英语广场,2019-05-17 08:51,1,0,1,2704
2088,浅析中英文互译中习语翻译的常见方法,杨青平,英语广场,2019-05-17 08:51,0,0,0,2704
2089,区域旅游景点特色词的文化归译研究――以福建永泰县旅游景点为例,熊诗婷；周旭,英语广场,2019-05-17 08:51,0,0,0,2704
2090,三维目标在职高英语教学中的有效实施分析,陈芹；张艳,英语广场,2019-05-17 08:51,0,0,0,2704
2091,文化视角下中国不同地区引进电影片名的翻译,芦蓉；邵华,英语广场,2019-06-13 17:09,42,0,42,2704
2092,广西红色旅游文化景区文本翻译中存在的问题及策略研究――以阳朔徐悲鸿故居为例,肖珂珂；黄秋萍,英语广场,2019-06-13 17:09,0,0,0,2704
2093,浅析英语广告汉译中的受众意识,杨蓓,英语广场,2019-06-13 17:09,1,0,1,2704
2094,大数据时代大学英语的“个性化”教学探究,唐雯琬,英语广场,2019-06-13 17:09,4,0,4,2704
2095,浅析初中英语阅读课教学与学科核心素养培养,郑礼宝,英语广场,2019-06-13 17:09,19,0,19,2704
2096,基于“微课”的翻转课堂模式在高中英语教学中的应用初探,杨丽,英语广场,2019-06-13 17:09,6,0,6,2704
2097,图式理论与农村中学英语阅读教学探析,王贞,英语广场,2019-06-13 17:09,1,0,1,2704
2098,浅议如何培养初中生的英语语言感知能力,王海燕,英语广场,2019-06-13 17:09,0,0,0,2704
2099,培养中职英语课堂学生阅读兴趣的实践与探索,沈爱侠,英语广场,2019-06-13 17:09,1,0,1,2704
2100,试论利用交互式电子白板提升中学英语教学的课堂有效性,解慧平,英语广场,2019-06-13 17:09,2,0,2,2704
2101,从多维度视角看待高中英语歌曲教学,贾振君,英语广场,2019-06-13 17:09,0,0,0,2704
2102,基于教材文本的高中英语读写整合课的优化策略,陈有祥,英语广场,2019-06-13 17:09,1,0,1,2704
2103,布朗语料库族系对比及应用现状研究,高亢,英语广场,2019-05-17 08:51,0,0,0,2704
2104,从大脑语言功能边侧化角度论儿童二语习得优势,任玲玲,英语广场,2019-05-17 08:51,0,0,0,2704
2105,英语谚语的语言特征分析及其翻译方法探讨,潘芮莹,英语广场,2019-05-17 08:51,3,0,3,2704
2106,浅析感知规律在大学英语教学中的应用,陈娇,英语广场,2019-05-17 08:51,1,0,1,2704
2107,浅谈计算机技术与高校英语教学的有机整合策略,陈茂佳,英语广场,2019-05-17 08:51,2,0,2,2704
2108,建构主义理论对高校艺术英语阅读的启示,庆格乐,英语广场,2019-05-17 08:51,2,0,2,2704
2109,雅思听力对大学英语听力策略的启示,赖丹,英语广场,2019-05-17 08:51,0,0,0,2704
2112,思维导图在初中英语教学中的应用研究,郑少平,英语广场,2019-05-17 08:51,8,0,8,2704
2113,高中英语阅读教学中跨文化意识的培养,邢峰,英语广场,2019-05-17 08:51,12,0,12,2704
2115,基于核心素养的高中英语阅读教学策略探究,黄国宝,英语广场,2019-05-17 08:51,13,0,13,2704
2116,微博对高中学生英语能力提高的效用探究,倪永健,英语广场,2019-05-17 08:51,0,0,0,2704
2117,英语课堂教学情景设置研究,仲明凤,英语广场,2019-05-17 08:51,0,0,0,2704
2118,浅谈翻转式课堂在高中英语教学中的运用,张华俊,英语广场,2019-05-17 08:51,1,0,1,2704
2119,高中英语词汇教学问题分析与对策研究,韦绘娜,英语广场,2019-05-17 08:51,4,0,4,2704
2120,初中英语课堂多元化教学评价体系的构建,尚雯文,英语广场,2019-05-17 08:51,4,0,4,2704
2121,合作学习原则在英语教学中的应用,刘艺,英语广场,2019-05-17 08:51,1,0,1,2704
2124,现代信息技术对初中英语课程教学的影响研究,罗昭然,英语广场,2019-05-17 08:51,7,0,7,2704
2125,高中英语教师有效提问与学生批判性思维的培养,黄丛丛,英语广场,2019-05-17 08:51,4,0,4,2704
2126,高中英语写作训练的原则与形式,宋雨敏,英语广场,2019-05-17 08:51,2,0,2,2704
2127,基于整本书阅读的初中英语阅读教学策略研究,王丽君,英语广场,2019-05-17 08:51,17,0,17,2704
2128,浅析在主题性意义探究活动中立德树人,傅安儿,英语广场,2019-05-17 08:51,0,0,0,2704
2129,英语师范教育课程中学科教学知识的培养策略,吴静,英语广场,2019-05-17 08:51,0,0,0,2704
2130,小组合作学习在初中英语词汇教学中的应用,龚德金,英语广场,2019-05-17 08:51,9,0,9,2704
2131,基于核心素养下的学业水平测试词汇复习――一节市级公开课的启示,谷子兰,英语广场,2019-05-17 08:51,1,0,1,2704
2132,文化走出去背景下英语教学中跨文化交际能力的培养,闫鑫,英语广场,2019-05-17 08:51,6,0,6,2704
2133,英语专业学生网络自主学习现状调查,蔡芳敏,英语广场,2019-05-17 08:51,0,0,0,2704
2134,教育供给侧改革视阈下大学英语教改路径浅析,骆园,英语广场,2019-05-17 08:51,0,0,0,2704
2135,解析大学英语高效学习策略,刘虞婷,英语广场,2019-05-17 08:51,1,0,1,2704
2136,英语口译教学的目标与内容选择,张莹,英语广场,2019-05-17 08:51,0,0,0,2704
2137,高职英语听说课分层教学中的微课教学模式应用,赵欣,英语广场,2019-05-17 08:51,5,0,5,2704
2138,对分课堂模式在大学英语阅读教学中的实践分析,白玲玲,英语广场,2019-05-17 08:51,9,0,9,2704
2139,基于翻转课堂的ESP网络课程群混合式教学模式研究,王贵芳,英语广场,2019-05-17 08:51,4,0,4,2704
2140,语块视角下的大学英语翻译教学的有效性探析,刘雪莲,英语广场,2019-05-17 08:51,1,0,1,2704
2141,“互联网+”背景下高职院校学生英语听力能力培养的教与学,何莺,英语广场,2019-05-17 08:51,4,0,4,2704
2142,外籍教师对小学生英语学习的影响,曹琴琴,英语广场,2019-05-17 08:51,0,0,0,2704
2143,运用数字化手段建设边缘化高三英语课堂文化,卓秀清,英语广场,2019-05-17 08:51,0,0,0,2704
2144,初中英语教学中的阅读教学策略,罗成莲,英语广场,2019-05-17 08:51,5,0,5,2704
2145,基于人本主义理论的歌曲翻译教学策略探析,倪艳笑,英语广场,2019-06-13 17:09,0,0,0,2704
2146,公共场合英语翻译常见问题及对策,夏洁,英语广场,2019-06-13 17:09,1,0,1,2704
2147,浅析交替传译中语际转换障碍的消除――以“2018年李克强总理答记者问”为例,邹盼；李珊,英语广场,2019-06-13 17:09,0,0,0,2704
2148,略论中国特色词语的英语翻译策略方法,潘芮莹,英语广场,2019-06-13 17:09,1,0,1,2704
2149,“一带一路”倡议下外宣翻译策略研究,樊坤铭,英语广场,2019-06-13 17:09,2,0,2,2704
2150,专门用途外语文体在教学中的信息化手段研究,杜蘅；周天兵,英语广场,2019-06-13 17:09,0,0,0,2704
2151,商业类文本汉译探析,李林霞,英语广场,2019-06-13 17:09,0,0,0,2704
2152,基于多维视角分析英语语言学研究,罗洁,英语广场,2019-06-13 17:09,1,0,1,2704
2153,关于英语二语词汇识别的探索,左宁；姜军,英语广场,2019-06-13 17:09,0,0,0,2704
2154,语境理论在大学英语词汇教学中的价值和应用策略,高玉荣,英语广场,2019-06-13 17:09,1,0,1,2704
2157,浅析大学英语视听说课的教学难点及教学策略,肖婷,英语广场,2019-05-17 08:51,1,0,1,2704
2158,基于网络平台的高职英语教学模式研究,韦玮,英语广场,2019-05-17 08:51,6,0,6,2704
2160,如何超越英语的单环学习模式,龙娟,英语广场,2019-05-17 08:51,0,0,0,2704
2161,探究认知语言学在大学英语阅读教学中的应用,邓小兰,英语广场,2019-06-13 17:09,0,0,0,2704
2162,建构主义理论视野下的无损检测专业英语词汇学习策略应用,高洁,英语广场,2019-06-13 17:09,0,0,0,2704
2163,浅谈中式英语(Chinglish)的特点、现状及前景,何振宇,英语广场,2019-06-13 17:09,0,0,0,2704
2165,独立学院商务英语专业“订单式”人才培养模式的探索――以广陵学院为例,张小红,英语广场,2019-06-13 17:09,2,0,2,2704
2166,探究式学习在高中英语阅读教学中的应用,武玉文,英语广场,2019-06-13 17:09,8,0,8,2704
2167,合作学习在高中英语口语教学中的应用探究,魏晓燕,英语广场,2019-06-13 17:09,6,0,6,2704
2168,On the Connotations of Color Words in Chinese-Western Culture,叶霞；翟宝杰,英语广场,2019-05-17 08:51,0,0,0,2704
2169,中国文化在沪上留学生中传播效果调查,从；熊淑慧,英语广场,2019-05-17 08:51,0,0,0,2704
2170,核心素养视角下跨文化交际中的时间文化差异探析,王星誉,英语广场,2019-06-13 17:09,1,0,1,2704
2171,The Roles Women Played During the Crusades,李娇；李永芹,英语广场,2019-06-13 17:09,0,0,0,2704
2172,Should and Can Flipped Classroom Be Introduced to Secondary Vocational Schools in China?,刘燕铭,英语广场,2019-06-13 17:09,0,0,0,2704
2173,从生态翻译学看王永年译本《警察与赞美诗》,倪藜,英语广场,2019-07-08 14:53,0,0,0,2704
2174,《呐喊》英译本中的文化负载词翻译策略评析,吴婷；祁文慧,英语广场,2019-07-08 14:53,49,0,49,2704
2175,生态翻译学视域下《锦瑟》英译三个维度的对比分析――基于译者的适应与选择,孙霞；魏盼盼,英语广场,2019-07-08 14:53,1,0,1,2704
2176,《三国演义》第一回C.H.Brewitt-Taylor译本赏析,雷莉,英语广场,2019-07-08 14:53,0,0,0,2704
2177,英语文学翻译中艺术语言的处理原则探究,高岩,英语广场,2019-07-08 14:53,7,0,7,2704
2178,文学翻译中作者与翻译者之间的意识冲突分析,余倩；张军,英语广场,2019-07-08 14:53,1,0,1,2704
2180,约翰・缪尔《夏日走过山间》之矛盾与作者思想分析,王家琪,英语广场,2019-07-08 14:53,1,0,1,2704
2182,浅析美狄亚的女性意识演变,荣正浩,英语广场,2019-07-08 14:53,1,0,1,2704
2183,Charlotte Written by David Foenkinos: Tragic Life of the Age,刘孟旦,英语广场,2019-07-08 14:53,0,0,0,2704
2184,《奥瑟罗》与《麦克白》:从“性格悲剧”透视蛊惑对人心的影响,黄宇u,英语广场,2019-07-08 14:53,0,0,0,2704
2185,语用学视角解读海明威小说《杀人者》,张娟,英语广场,2019-07-08 14:53,0,0,0,2704
2186,《老人与海》的语言运用研究,谷彦君,英语广场,2019-07-08 14:53,1,0,1,2704
2187,认知图式理论视角下的视译信息加工研究,陈逸林,英语广场,2019-07-08 14:53,0,0,0,2704
2188,批评话语分析初探,郭雨；赵林静,英语广场,2019-07-08 14:53,0,0,0,2704
2189,中国园林文化对外传播的现状与改进措施,陈星聚；张发勇,英语广场,2019-07-08 14:53,24,0,24,2704
2190,接受美学理论视角下纪录片字幕翻译研究――以《美丽中国》为例,张晓诗；高梅,英语广场,2019-07-08 14:53,4,0,4,2704
2191,Translation Strategies from the Perspective of Hypotaxis and Parataxis,刘欣；朱宇丹,英语广场,2019-07-08 14:53,2,0,2,2704
2194,"巧翻译,高效率――谈英语翻译有效性",康敏,英语广场,2019-07-08 14:53,0,0,0,2704
2195,浅析英汉交替传译中的口译笔记,狄凡,英语广场,2019-07-08 14:53,6,0,6,2704
2196,目的论在学术文本翻译中的应用――以《21世纪营销理念》节选为例,刘晶晶；邵华,英语广场,2019-07-08 14:53,29,0,29,2704
2197,民航英语特点及翻译策略探究,徐霞,英语广场,2019-07-08 14:53,1,0,1,2704
2198,文化翻译理论视角下的旅游英语翻译策略研究,赵晓霞,英语广场,2019-07-08 14:53,8,0,8,2704
2199,试论二语读后续写中话题熟悉度对协同的影响,赵方,英语广场,2019-07-08 14:53,0,0,0,2704
2200,英语委婉语的构成及语用分析,杨艺欣,英语广场,2019-07-08 14:53,3,0,3,2704
2201,隐喻词语的认知阐释与翻译处理,张化丽,英语广场,2019-07-08 14:53,0,0,0,2704
2202,基于跨文化交际能力视角的大学英语教学探索,王琦,英语广场,2019-07-08 14:53,0,0,0,2704
2203,跨文化交际能力培养与大学英语教学初探,王忠林,英语广场,2019-07-08 14:53,1,0,1,2704
2204,高校艺术特长生的外语学习焦虑调查及交际意愿激励策略研究,康蕊,英语广场,2019-07-08 14:53,0,0,0,2704
2205,大学英语写作教学中的教师反馈研究,汪虹,英语广场,2019-07-08 14:53,3,0,3,2704
2206,研究生英语拓展课――英美文化的智慧教学模式研究,梁庆峰,英语广场,2019-07-08 14:53,1,0,1,2704
2207,混合式教学模式下的大学英语教材编写实践――基于《中国英语能力等级量表》,胡翠霞；黄列梅,英语广场,2019-07-08 14:53,6,0,6,2704
2208,互联网语境下大学生英美文学阅读现状与对策研究,张益民,英语广场,2019-07-08 14:53,3,0,3,2704
2209,概念整合理论对大学英语写作教学的启示,钱慧,英语广场,2019-07-08 14:53,0,0,0,2704
2210,现代高职英语课堂教学面临的新问题及对策,雷霞,英语广场,2019-07-08 14:53,3,0,3,2704
2211,浅谈如何激发高职英语课堂活力,张彦鹏,英语广场,2019-07-08 14:53,0,0,0,2704
2212,移动互联网环境下混合式教学模式在高职英语教学中的实践,张红,英语广场,2019-07-08 14:53,6,0,6,2704
2213,“一带一路”背景下商务英语专业学生跨文化交际能力培养研究,刘雯,英语广场,2019-07-08 14:53,1,0,1,2704
2214,思政理念观照下的高校外语类课程体系构建与探索,刘静,英语广场,2019-07-08 14:53,5,0,5,2704
2216,互动教学模式在高职公共英语教学中的应用研究,常劲松,英语广场,2019-07-08 14:53,1,0,1,2704
2218,微博在英语专业学生自主学习中的应用现状调查――以滁州学院为例,汪吉；舒卫征；厉凌华,英语广场,2019-07-08 14:53,0,0,0,2704
2219,探析功能翻译理论在高职高专英语翻译教学中的运用,史菊萍,英语广场,2019-07-08 14:53,1,0,1,2704
2220,混合式学习在大学英语视听说课程中的应用研究,赵丹,英语广场,2019-07-08 14:53,2,0,2,2704
2221,地方高校外语专业学生思辨能力培养研究与实践,杜淑萍；王晓杰,英语广场,2019-07-08 14:53,0,0,0,2704
2222,内容依托式教学研究综述,刘津男；解芳,英语广场,2019-07-08 14:53,1,0,1,2704
2223,基于MOOC的英语教学混合课堂研究,徐莉莉,英语广场,2019-07-08 14:53,3,0,3,2704
2224,翻转课堂视域下大学英语教学理念重构刍议,岑嵩,英语广场,2019-07-08 14:53,3,0,3,2704
2227,“互联网+”环境下高职英语教师教学能力的提升,罗晗,英语广场,2019-07-08 14:53,3,0,3,2704
2228,以就业为引导的大学英语教学探究,傅榕,英语广场,2019-07-08 14:53,0,0,0,2704
2229,高职高专英语教学中学生非智力因素培养研究,叶秋萍,英语广场,2019-07-08 14:53,1,0,1,2704
2230,基于慕课的专门用途英语混合式教学探讨,任静,英语广场,2019-07-08 14:53,1,0,1,2704
2231,基于学科核心素养的大学英语课堂教学策略研究,任雪娇,英语广场,2019-07-08 14:53,5,0,5,2704
2233,基于输入输出假设的大学英语听说课翻转课堂研究,姜文静,英语广场,2019-07-08 14:53,2,0,2,2704
2234,基于慕课模式的大学英语教学改革,王明明,英语广场,2019-07-08 14:53,7,0,7,2704
2235,新时期卫校英语教学的可视化模式特色研究,钟璐轶；张卫红,英语广场,2019-07-08 14:53,1,0,1,2704
2236,自主学习理论下的高校英语教学实践研究,孙艾,英语广场,2019-07-08 14:53,1,0,1,2704
2237,基于SPOC的大学英语智慧课堂效度实证研究,赵燕,英语广场,2019-07-08 14:53,1,0,1,2704
2238,大学英语课程商科应用型人才培养的思考,盛维,英语广场,2019-07-08 14:53,0,0,0,2704
2239,浅析高中英语乡土课程资源开发和利用,林延,英语广场,2019-07-08 14:53,3,0,3,2704
2240,核心素养指向下小学英语教学中渗透绘本阅读的实践,许丽薇,英语广场,2019-07-08 14:53,13,0,13,2704
2241,有助于核心素养培养的英语课前值日报告,屈旖旎,英语广场,2019-07-08 14:53,0,0,0,2704
2242,基于“互联网+”中职英语教学方法的创新探索,杜兴堂,英语广场,2019-07-08 14:53,4,0,4,2704
2243,“师友互助”模式下初中英语阅读理解预习的新路径初探,吉承玲,英语广场,2019-07-08 14:53,8,0,8,2704
2244,大数据构建下“高中英语智慧课堂”的效果观察,吴p,英语广场,2019-07-08 14:53,3,0,3,2704
2245,浅析自然拼读法在小学英语教学中的应用,马春圆,英语广场,2019-07-08 14:53,6,0,6,2704
2246,英语核心素养在中职英语课堂教学的渗透研究,罗东明；罗翠珠,英语广场,2019-07-08 14:53,10,0,10,2704
2247,中职英语课堂合作学习理论与实践模式的探讨,陈宇,英语广场,2019-07-08 14:53,1,0,1,2704
2248,基于语篇的高二英语阅读教学的实践分析,许盼盼,英语广场,2019-07-08 14:53,1,0,1,2704
2249,初中英语阅读教学中信息技术的应用效果分析,王莉莉,英语广场,2019-07-08 14:53,8,0,8,2704
2250,浅析英语课时目标的设计及实现,范咏梅,英语广场,2019-07-08 14:53,0,0,0,2704
2251,高中英语“原题”作答失分的成因及对策,朱改转；魏志军,英语广场,2019-07-08 14:53,1,0,1,2704
2252,小学低年级英语绘本有效教学构建探究,张婷,英语广场,2019-07-08 14:53,4,0,4,2704
2253,小学英语课堂小组合作学习的探究与运用,梁莹莹,英语广场,2019-07-08 14:53,7,0,7,2704
2254,语义图策略在高中英语语篇阅读中的应用探讨,方舟,英语广场,2019-07-08 14:53,3,0,3,2704
2255,基于学生体验的高中英语写作教学,曾海萍,英语广场,2019-07-08 14:53,0,0,0,2704
2256,小学英语对话教学中的话题设计探析,许丽晶,英语广场,2019-07-08 14:53,3,0,3,2704
2257,小学英语“生长课堂”中学生跨文化意识的培养,孙剑梅,英语广场,2019-07-08 14:53,5,0,5,2704
2258,初中英语课堂教学中多媒体课件的应用研究,张永松,英语广场,2019-07-08 14:53,3,0,3,2704
2259,分组合作学习在中职英语教学中的实践研究,黄燕华,英语广场,2019-07-08 14:53,7,0,7,2704
