序号,篇名,作者,刊名,发表时间,被引,自引,外引,文献总数
1327,基于语料库的《月亮与六便士》检索分析与研究,宋晨曦,英语广场,2020-02-15,0,0,0,2704
1328,高校大学生网络语言使用动机与跨文化交际能力关系实证研究,尚咏尉；宿哲骞；秦发财,英语广场,2020-02-15,0,0,0,2704
1329,从一维到多维：语言递归机制在语义层面的解读与启示,高二欢,英语广场,2020-02-15,0,0,0,2704
1330,戴着“镣铐”跳舞――互文视域中译者的创造性,岳启业,英语广场,2020-02-15,0,0,0,2704
1331,山东高校外语专业布局与人才需求调查研究,杨洪娟,英语广场,2020-02-15,1,0,1,2704
1332,军队院校外语教学中学员军事素质的培养研究,赵茹兰；孔令兰；刘怡玮,英语广场,2020-02-15,0,0,0,2704
1333,电视真人秀节目中的拒绝策略――以《这！就是街舞》为例,陈天贻；刘红,英语广场,2020-02-15,0,0,0,2704
1334,基辛格效应：中介语石化现象再思考,王李霞,英语广场,2020-02-15,0,0,0,2704
1335,《第二语言研究――方法与设计》（第二版）评介,桂雅馨；武娜,英语广场,2020-02-15,0,0,0,2704
1336,高质量发展阶段高校外语教育人才培养模式的转变与发展,杜云飞；赵红梅；熊娇；姜有为；周运海,英语广场,2020-02-15,1,1,0,2704
1337,医学英语文献汉译中主位推进模式分析,曾环宇；田俊英,英语广场,2020-02-15,0,0,0,2704
1338,多模态话语分析在基础英语课程中的应用,刘柳；王永婕,英语广场,2020-02-15,0,0,0,2704
1339,大学英语词性教学的意义及策略探究,董t,英语广场,2020-02-15,1,0,1,2704
1340,基于项目式教学的体育专业大学英语教学改革初探,黄燕萍,英语广场,2020-02-15,0,0,0,2704
1341,关联理论视域下的电影字幕翻译――以《我不是药神》为例,王馨伟,英语广场,2020-02-15,1,0,1,2704
1342,目的论视阈下的翻译策略选择――归化和异化,张铁虎,英语广场,2020-02-15,4,0,4,2704
1343,餐饮翻译的策略研究――以福建石狮地区为例,董雅芬,英语广场,2020-02-15,1,0,1,2704
1344,探析商务英语信函写作中东西方文化差异带来的影响,姜敏；胡明珠,英语广场,2020-02-15,1,0,1,2704
1345,功能对等理论和语境论下“妻子”称谓及其英译研究,黄艳新；李艳芳,英语广场,2020-02-15,0,0,0,2704
1346,“目的论”视角下从“可读性”出发浅谈汉译英歌词翻译技巧――以华晨宇的歌词为例,郭欣悦,英语广场,2020-02-15,0,0,0,2704
1347,语义翻译和交际翻译视角下浅谈奶粉说明书的汉译,胡乔；赫云露；杨燕,英语广场,2020-02-15,0,0,0,2704
1348,基于互动协同观的大学英语口语教学,陈婧,英语广场,2020-02-15,0,0,0,2704
1349,基于MOOCs资源的个性化学习,郁俊玲；马芫；吴青宁；魏蝶蝶；续彩虹,英语广场,2020-02-15,0,0,0,2704
1350,基于LICC范式下的英语教师课堂提问行为研究,杨春,英语广场,2020-02-15,1,0,1,2704
1351,跨境电子商务背景下商务英语课程改革研究,李真真；王艺璇,英语广场,2020-02-15,1,0,1,2704
1352,高校英语教学中学生文化能力培养的策略研究,杨晓梅,英语广场,2020-02-15,2,0,2,2704
1353,OBE导向下二外日语课程大纲的设计,黄洁,英语广场,2020-02-15,1,0,1,2704
1354,善用微课“破”难点、“解”疑点――微课在大学英语阅读教学中的应用策略研究,李林钰,英语广场,2020-02-15,3,0,3,2704
1355,基于生态学的英语实践教学研究,孟娴,英语广场,2020-02-15,1,0,1,2704
1356,刍议大学英语教材的合理运用――以《大学英语综合教程》为例,黄芳芳,英语广场,2020-02-15,0,0,0,2704
1357,微信阅读公众号打卡对英语专业学生英语阅读的影响,蔡青青,英语广场,2020-02-15,1,0,1,2704
1358,融合移动学习的大学英语教学新模式及其实践运用策略,靳亦诗,英语广场,2020-02-15,1,0,1,2704
1359,信息化技术在高职商务英语专业语言类课程教学中的应用与思考――以微课为例,多英学,英语广场,2020-02-15,2,0,2,2704
1360,大学英语教学引入专门用途英语教学的改革方向探究,张晓琳,英语广场,2020-02-15,0,0,0,2704
1361,高校英语教学中融入中国传统文化的现状与几点思考,谭惠,英语广场,2020-02-15,3,0,3,2704
1362,基于微课的翻转课堂在高职公共英语写作教学中的应用研究,王小丽,英语广场,2020-02-15,2,0,2,2704
1363,浅析英美文学与大学英语教学的有效融合,王成,英语广场,2020-02-15,5,0,5,2704
1364,“互联网+”背景下大学英语听说课程多元教学模式构建,钱慧,英语广场,2020-02-15,0,0,0,2704
1365,文化自信视角下的大学英语教学研究,孙琼,英语广场,2020-02-15,1,0,1,2704
1366,《大学英语》与高职学生综合素质培养――以轨道交通类行业为例,柏哲,英语广场,2020-02-15,2,0,2,2704
1367,基于SPOC的大学英语公共课学生反馈调查,侯骄芙；唐晓菲；李林晏；周沛霖,英语广场,2020-02-15,0,0,0,2704
1368,浅谈高校英语课堂沉默成因及其对策,夏云,英语广场,2020-02-15,0,0,0,2704
1369,自媒体环境下的大学英语教学策略研究,周坚坚,英语广场,2020-02-15,0,0,0,2704
1370,国际化背景下地方高校开展雅思教学的可行性研究及对策――以北方工业大学为例,张玉静,英语广场,2020-02-15,0,0,0,2704
1371,初中英语教学中如何培养学生自主学习能力,左伟,英语广场,2020-02-15,1,0,1,2704
1372,文化“走出去”背景下羌族传统服饰名称英译分析,苏艳飞,英语广场,2020-02-15,2,0,2,2704
1373,浅谈职业英语口语教学中的语言审美,张雷,英语广场,2020-02-15,0,0,0,2704
1374,《考而不死是为神》的汉译英翻译实践报告――以郭沫若翻译理论为指导,张悦,英语广场,2020-02-15,0,0,0,2704
1375,句法复杂性实证类研究述评,沈悦,英语广场,2020-02-15,0,0,0,2704
1376,高职商务英语专业人才培养模式改革研究――以“中国制造2025”战略和“多元智能”理论为视角,程宇,英语广场,2020-02-15,2,0,2,2704
1377,基于BOPPPS的翻转课堂教学设计研究――以《高级英语》为例,牛培；吴爱华,英语广场,2020-02-15,0,0,0,2704
1378,基于产出导向法的大学英语视听说教学实践探析,吕兆芳,英语广场,2020-02-15,0,0,0,2704
1379,探究微助教结合传统教学在PRETCO翻译题的运用,冯嘉文,英语广场,2020-02-15,0,0,0,2704
1380,专门用途英语课堂教学场景应用研究,薛慧娟,英语广场,2020-02-15,0,0,0,2704
1381,高职大学英语信息化教学设计探讨――以《前景实用英语》第一册Unit 6 The Environment为例,许翠敏,英语广场,2020-02-15,1,0,1,2704
1382,高职高专英语口语大赛备赛策略研究,农红专,英语广场,2020-02-15,0,0,0,2704
1383,高校英语教育中协调教学的应用分析,郭子菁,英语广场,2020-02-15,1,0,1,2704
1384,大学生英语思辨能力培养中的问题、影响因素及策略,吴彦凤,英语广场,2020-02-15,1,0,1,2704
1385,基于POA的中学英语口语教学研究,王浴四季；吕铁金,英语广场,2020-02-15,0,0,0,2704
1386,高中生英语阅读自主学习能力提升策略研究,孙红英,英语广场,2020-02-15,0,0,0,2704
1387,提高小学英语课堂教学趣味性策略研究――以“牛津英语（上海版）3B M3 U3 Seasons”为例,许画,英语广场,2020-02-15,2,0,2,2704
1388,思维导图在高中英语写作教学中的应用,张玲,英语广场,2020-02-15,4,0,4,2704
1389,绘本在小学英语核心素养教学中的作用探究,赵宏燕,英语广场,2020-02-15,5,0,5,2704
1390,探讨英语学习活动观在高中英语阅读教学中的应用,张展,英语广场,2020-02-15,1,0,1,2704
1391,基于核心素养的小学英语高年级语法板块教学设计探究,李兰萍,英语广场,2020-02-15,1,0,1,2704
1392,核心素养视角下初中英语口语能力培养策略研究,李爱民,英语广场,2020-02-15,3,0,3,2704
1393,教育信息化时代大学英语课堂教学优化研究,薛美薇,英语广场,2020-02-15,1,0,1,2704
1394,非智力因素对大学英语教学的影响研究,贾晓娇,英语广场,2020-02-15,0,0,0,2704
1395,信息技术融入课堂的大学英语教师教学转型发展研究,刘毅,英语广场,2020-02-15,0,0,0,2704
1396,“蒙―英―汉”三语环境下蒙医药、预科英语教学质量监控实证研究――以内蒙古医科大学为例,于晓雯,英语广场,2020-02-15,1,0,1,2704
1397,高职学生英语学习状况调查研究报告――以安顺职业技术学院为例,刘静；龚红；汪恒；李明娟,英语广场,2020-02-15,0,0,0,2704
1398,基于混合式教学的大学英语翻转课堂可行性研究,王成秀,英语广场,2020-02-15,3,0,3,2704
1399,大学英语新题型及解题策略,张小红,英语广场,2020-02-15,0,0,0,2704
1400,基于多重支架的英语写作课堂教学研究,李佳,英语广场,2020-02-15,2,0,2,2704
1401,大学英语教师激励性评价对课堂互动影响的行动研究,柯文娟,英语广场,2020-02-15,1,0,1,2704
1402,基础英语信息化教学模式初探,王立阳,英语广场,2020-02-15,0,0,0,2704
1403,中华优秀文化视域下的中小学英语教学,姜萍,英语广场,2020-02-15,1,0,1,2704
1404,基于“十二字方针”的小学英语课堂建构,陆春虹,英语广场,2020-02-15,0,0,0,2704
1405,“三义三向”文本分析法与卓越英语教师阅读教学能力培养研究――以How Daisy Learned To Help Wildlife教学设计为例,米海燕；覃赓,英语广场,2020-02-15,0,0,0,2704
1406,浅谈课堂互动教学模式在高中英语教学中的运用,张一玮,英语广场,2020-02-15,7,0,7,2704
1407,解析英语学习活动观的问题链在高中英语阅读教学设计中的应用,薛莉琳,英语广场,2020-02-15,3,0,3,2704
1408,对小学英语阅读教学策略的思考与研究,徐颖倩,英语广场,2020-02-15,1,0,1,2704
1409,初中英语教学中思维品质的培养策略探究,王筱彦,英语广场,2020-02-15,3,0,3,2704
1410,浅议初中英语词汇教学的有效手段,苏健,英语广场,2020-02-15,1,0,1,2704
1411,网络环境下小学英语教学策略的分析,秦丽,英语广场,2020-02-15,2,0,2,2704
1412,如何提高指导初中生英语课外阅读的有效性,梅佳,英语广场,2020-02-15,1,0,1,2704
1413,浅述思维导图对高中生英语阅读理解能力的促进作用,罗玉娟,英语广场,2020-02-15,1,0,1,2704
1414,四味“真”火，溢出芳香满堂――核心素养下的高中英语课堂构建,林俊香,英语广场,2020-02-15,0,0,0,2704
1415,关注问题设计，指向思维发展――培养小学生英语思维品质的几点看法,顾雪霞,英语广场,2020-02-15,5,0,5,2704
1416,初高中英语衔接存在的问题及应对策略,黄怀娟,英语广场,2020-02-15,0,0,0,2704
1417,初中英语课堂口语教学中的二语习得理论,范依芸,英语广场,2020-02-15,0,0,0,2704
1418,如何提高学生英文单词的理解记忆和运用能力,池信慧,英语广场,2020-02-15,1,0,1,2704
1419,浅析如何提高小学生英语学习兴趣,陈雪；邢玉霜,英语广场,2020-02-15,4,0,4,2704
1420,如何提高五六年级学生的英语阅读水平,龚梦阳,英语广场,2020-02-15,0,0,0,2704
1421,浅析科技论文的英文摘要写作模式,魏羽,英语广场,2020-02-15,0,0,0,2704
1422,“一带一路”背景下永泰葛岭旅游景点对外宣传翻译研究,余诗颖；徐巧燕,英语广场,2020-02-15,0,0,0,2704
1423,语法教学中“Top-down”和“Bottom-up”方法的整合――名词性从句教学实例,曹娅若,英语广场,2020-02-15,0,0,0,2704
1424,警务英语中跨文化交际探究,张靓,英语广场,2020-02-15,0,0,0,2704
1425,文化自信视域下高校英语专业学生文化意识培养现状与对策研究――以徐州地区高校为例,刘海莉；朱玉清；邓瑶,英语广场,2020-02-15,2,0,2,2704
1426,泛在学习视域下SPOC教学模式应用于大学英语辩论课程的研究,张稚敏,英语广场,2020-02-15,2,0,2,2704
1427,任务型教学法用于大学英语定语从句教学的研究,周玲,英语广场,2020-02-15,0,0,0,2704
1428,试论纸质词典对英语学习的作用,李超；胡昆,英语广场,2020-02-15,1,0,1,2704
1429,顺应论视角下英语演讲中模糊限制语的语用分析,孙梦瑶；荣正浩,英语广场,2020-02-15,0,0,0,2704
1430,基于语料库对构式“What are you talking about”的元语用功能分析,刘涵,英语广场,2020-02-15,0,0,0,2704
1431,浅析隐喻视角下英语词汇前缀的联想记忆,徐莹,英语广场,2020-02-15,0,0,0,2704
1432,语言经济学原则下中国影视字幕翻译研究――以《甄执》为例,林增辉；叶红君；郑淇筠,英语广场,2020-02-15,0,0,0,2704
1433,旅游形象宣传片的多模态话语分析,聂雯,英语广场,2020-02-15,0,0,0,2704
1434,国际商法双语课堂下的案例分析教学探讨,李美,英语广场,2020-02-15,0,0,0,2704
1435,浅谈“变译”理论在汉英翻译中的应用――以杨译《红楼梦》为例,刘瑶,英语广场,2020-01-25,1,0,1,2704
1436,译者主体性在译文中的体现――以《鹿鼎记》英译本为例,刘静,英语广场,2020-01-25,0,0,0,2704
1437,英语文学翻译中文化差异的处理研究,罗媛媛,英语广场,2020-01-25,1,0,1,2704
1438,智能时代背景下的翻译专业笔译教学探讨,赵文,英语广场,2020-01-25,1,0,1,2704
1439,关于现代信息技术与小学英语教学的融合研究,林淑婷,英语广场,2020-01-25,6,0,6,2704
1440,基于核心素养的小学英语差异教学实践,蒋丽丽,英语广场,2020-01-25,2,0,2,2704
1441,职业高中学生英语阅读能力养成途径,苏婷婷,英语广场,2020-01-25,0,0,0,2704
1442,多元智能理论在高中英语教学中的应用研究,林芝,英语广场,2020-01-25,1,0,1,2704
1443,刍议初中英语课堂教学存在的问题及优化对策,方婉宁,英语广场,2020-01-25,1,0,1,2704
1444,新课改背景下高中英语教学改革的创新路径选择,陈娜,英语广场,2020-01-25,0,0,0,2704
1445,过程取向的翻译案例教学研究,刘晓晨,英语广场,2020-01-25,0,0,0,2704
1446,建构主义视域下的大学英语话题特征分析,刘海,英语广场,2020-01-25,0,0,0,2704
1447,英文句子的形式美探讨,雷红,英语广场,2020-01-25,0,0,0,2704
1448,国内英语培训产业的误区及其应对策略,王振兴,英语广场,2020-01-25,0,0,0,2704
1449,论跨文化交际下大学英语教学模式构建策略,武红霞,英语广场,2020-01-25,3,0,3,2704
1450,跨文化大学英语课程评估量表的构建与检验,万能,英语广场,2020-01-25,0,0,0,2704
1451,应用型高校商务英语专业课程体系建设视角下的人才培养与规格分析,张伟；曾平；曾真,英语广场,2020-01-25,2,0,2,2704
1452,“互联网+”视域下高职英语翻转课堂兴趣培养研究,龚红；沈淼；秦文娅；谢媛媛,英语广场,2020-01-25,0,0,0,2704
1453,微课在大学英语视听说翻转课堂中的应用价值分析,夏君,英语广场,2020-01-25,2,0,2,2704
1454,大学英语教学从通用英语到学术英语的分析,周斌,英语广场,2020-01-25,0,0,0,2704
1455,"基于POA的大学英语读写翻转课堂教学设计与实践――以Door Closer,Are You？为例",常丹丹,英语广场,2020-01-25,1,0,1,2704
1456,基于PBL的英语专业写作教学模式探究,岳筑,英语广场,2020-01-25,0,0,0,2704
1457,“一带一路”倡议背景下山东省高校英语专业国际化人才培养路径探析,张玲,英语广场,2020-01-25,2,0,2,2704
1458,提升高职英语教学职业化的对策思考,李明乐,英语广场,2020-01-25,0,0,0,2704
1459,关于新时代提高高职英语课堂质量的探索与思考,贺毅夫,英语广场,2020-01-25,0,0,0,2704
1460,POA理论指导下《职场英语综合实训》教材编写设计思路,贺宏,英语广场,2020-01-25,0,0,0,2704
1461,大学英语教学中互动教学法的应用研究,李静,英语广场,2020-01-25,1,0,1,2704
1462,探讨高职英语教学中小组合作学习模式的有效运用,陈海强,英语广场,2020-01-25,1,0,1,2704
1463,新时期大学英语教学的创新与实践研究,黄强,英语广场,2020-01-25,15,0,15,2704
1464,基于iSmart平台的高职英语混合式课堂教学改革方案,张楠；张自胜,英语广场,2020-01-25,0,0,0,2704
1465,谈高职英语听说训练教改实验,朱慧,英语广场,2020-01-25,0,0,0,2704
1466,大学生思想政治教育在英语类精品在线开放课程推广中的作用,吴紫娟,英语广场,2020-01-25,1,0,1,2704
1467,网络环境下高职英语写作教学模式研究,王轶,英语广场,2020-01-25,0,0,0,2704
1468,从学生思辨能力培养的角度看大学英语精品课程建设,马越涧,英语广场,2020-01-25,2,0,2,2704
1469,基于逆向思维方法的高效英语翻译教学的有效开展,胡鹏,英语广场,2020-01-25,0,0,0,2704
1470,探讨基于语料库的大学英语分级教学模式有效性研究,赵乐芳,英语广场,2020-01-25,0,0,0,2704
1471,如何在高校英语教学中运用英文电影,李莉,英语广场,2020-01-25,0,0,0,2704
1472,功能翻译理论视域下高职学生英语翻译能力培养研究,张晓楠,英语广场,2020-01-25,3,0,3,2704
1473,跨文化背景下英语翻译技巧与视角转换问题研究,左瑜；高文捷,英语广场,2020-01-25,6,0,6,2704
1474,生态翻译学视角下的英语修辞格翻译探究,李丹,英语广场,2020-01-25,1,0,1,2704
1475,专利文献的翻译实践,张小冬,英语广场,2020-01-25,0,0,0,2704
1476,信息时代下环巢湖旅游语言景观公示语翻译对策研究,杨晨；汤玲玲,英语广场,2020-01-25,0,0,0,2704
1477,英语电影字幕翻译模式解析,周岚,英语广场,2020-01-25,1,0,1,2704
1478,从句子的理解看词汇语义与句法的互动关系,王宁,英语广场,2020-01-25,0,0,0,2704
1479,四级作文评分标准带给四级写作教学的启示,罗廷凤,英语广场,2020-01-25,0,0,0,2704
1480,ESP教学中多向合作教学模式之探讨,黄迎,英语广场,2020-01-25,0,0,0,2704
1481,“互联网+”环境下英语混合教学模式的探索,贾丹阳,英语广场,2020-01-25,2,0,2,2704
1482,《新视野大学英语读写教程》课程思政方法探索,杨D,英语广场,2020-01-25,2,0,2,2704
1483,微课程在高校商务英语口语教学中的应用研究,王英,英语广场,2020-01-25,0,0,0,2704
1484,高职旅游英语混合式教学模式有效性研究,范金平,英语广场,2020-01-25,1,0,1,2704
1485,中职德育教育在英语教学中的实践性探析,张雯,英语广场,2020-01-25,5,0,5,2704
1486,认知负荷理论指导下的专业四级讲座听力策略研究,胡悦,英语广场,2020-01-25,1,0,1,2704
1487,信息化背景下大学英语教学专业化授课模式探析,李攀科,英语广场,2020-01-25,0,0,0,2704
1488,学前教育专业的英语教育基本技能的培养与训练,李加；任莉枫,英语广场,2020-01-25,2,0,2,2704
1489,中职英语教学中强化基础英语与医用英语衔接问题探讨,刘敏,英语广场,2020-01-25,0,0,0,2704
1490,由一次磨课经历引发的Checkout Time板块教学的思考,冯伟,英语广场,2020-01-25,1,0,1,2704
1491,浅谈如何通过阅读教学改善高中英语的写作教学,邹静磊,英语广场,2020-01-25,1,0,1,2704
1492,探讨小学英语教学中核心素养的培养,胡洁琼,英语广场,2020-01-25,1,0,1,2704
1493,使用英语绘本提高小学生英语学习效果的可行性研究,韦琳；李硕果,英语广场,2020-01-25,3,0,3,2704
1494,探究核心素养下小学英语高效课堂教学的构建,余艺萍,英语广场,2020-01-25,11,0,11,2704
1495,浅议小组合作学习在中小学英语教学实践中的应用,欧阳芳菲,英语广场,2020-01-25,1,0,1,2704
1496,小学英语综合版块有效性教学路径探析,邵恒慧,英语广场,2020-01-25,1,0,1,2704
1497,小学低段英语课堂中同伴互助模式探究,王妙娟,英语广场,2020-01-25,1,0,1,2704
1498,基于核心素养的高中英语读写结合课RISE教学模式应用研究,苏越丽,英语广场,2020-01-25,2,0,2,2704
1499,小学英语教学中渗透道德教育的调查研究,王笑波,英语广场,2020-01-25,2,0,2,2704
1500,翻转课堂教学模式在中职英语教学中的应用,李洪媛,英语广场,2020-01-25,2,0,2,2704
1501,高中英语有效写作教学的实践探讨,黄蕴,英语广场,2020-01-25,1,0,1,2704
1502,初中英语阅读课教学与学科核心素养培养,何玲玲,英语广场,2020-01-25,5,0,5,2704
1503,核心素养背景下高中英语概要写作教学探究,洪珊珊,英语广场,2020-01-25,9,0,9,2704
1504,聚焦“核心素养”优化小学英语课堂教学,邵培培,英语广场,2020-01-25,4,0,4,2704
1505,多模态话语分析理论在初中英语教学中的应用,葛佶吉,英语广场,2020-01-25,2,0,2,2704
1506,融英语学科核心素养理念于初中英语教学设计的实践探索,广春娇；杨昌霞,英语广场,2020-01-25,3,0,3,2704
1507,翻转课堂模式下的英语教学设计探究,何忠家,英语广场,2020-01-25,1,0,1,2704
1508,基于语料库的《汤姆・索亚历险记》两个汉译本词汇操作规范对比研究,姜琴；王琴；曹庆珠,英语广场,2020-01-15,0,0,0,2704
1509,浅析许渊冲“三美”翻译理论在中国古诗英译中的运用,陈韵如,英语广场,2020-01-15,2,0,2,2704
1510,压迫与抗争下的成长――英文小说《灿烂千阳》的女性成长视角解读,张娟,英语广场,2020-01-15,1,0,1,2704
1511,英美语言文学研究现状与发展前景研究,王庆军,英语广场,2020-01-15,0,0,0,2704
1512,《武林外传》中幽默语言的语用学分析,董晶晶,英语广场,2020-01-15,0,0,0,2704
1513,跨文化交际中肢体身势语言差异研究,许晓晴,英语广场,2020-01-15,0,0,0,2704
1514,从言语幽默概论视角分析The Innocents Abroad的幽默文本及其汉译,杨小云；许薛,英语广场,2020-01-15,1,0,1,2704
1515,二语习得中中介语石化现象的形成原因与启示,季雨薇,英语广场,2020-01-15,0,0,0,2704
1516,输入假说指导下的语言环境创设研究,石玉洁；肖惜,英语广场,2020-01-15,0,0,0,2704
1517,认知隐喻理论在英语词汇教学中的意义及运用研究,陶冶情,英语广场,2020-01-15,0,0,0,2704
1518,力动态视角下英语情态动词语义表征的认知识解,邓晨,英语广场,2020-01-15,0,0,0,2704
1519,英语写作能力的构念界定与测试,梁晓婷,英语广场,2020-01-15,0,0,0,2704
1520,理工类学术英语语料库的构建及其应用初探,石峰,英语广场,2020-01-15,0,0,0,2704
1521,语义框架理论在跨文化外语学习中的应用研究,赵晨,英语广场,2020-01-15,0,0,0,2704
1522,“智慧型”翻转课堂生态环境的重构研究,王s,英语广场,2020-01-15,0,0,0,2704
1523,教育生态化对高职英语教育可持续发展的启示,赵春雨,英语广场,2020-01-15,2,0,2,2704
1524,高校英语教学中大学生跨文化意识的培养分析,孙萌遥,英语广场,2020-01-15,0,0,0,2704
1525,需求分析理论视角下ESP商务英语教师知识构成,彭晨晨,英语广场,2020-01-15,0,0,0,2704
1526,“互联网+”背景下高校公共英语教学研究,万宗琴,英语广场,2020-01-15,1,0,1,2704
1527,“互联网+”时代艺术类高校英语教师角色定位研究,陈大莲,英语广场,2020-01-15,0,0,0,2704
1528,浅谈高职商务英语专任教师队伍的建设――以《商务英语》教学为例,赵芳,英语广场,2020-01-15,0,0,0,2704
1529,关于提高公安干警警务英语应用能力的研究,张靓,英语广场,2020-01-15,0,0,0,2704
1530,民办高校英语专业翻译教学与课程思政融合的策略及途径研究,朱楠,英语广场,2020-01-15,1,0,1,2704
1531,浅析阅读圈模式在大学英语阅读教学中的应用,白玲玲,英语广场,2020-01-15,0,0,0,2704
1532,文化图式理论在中国文化英语教学中的需求分析,吕文君,英语广场,2020-01-15,0,0,0,2704
1533,浅析高职英语教学中教师的引导作用,孙云花,英语广场,2020-01-15,0,0,0,2704
1534,提升高职英语教学管理有效性的对策探究,吴琼,英语广场,2020-01-15,0,0,0,2704
1535,高职旅游英语教学中的职业能力培养探析,张凤琴,英语广场,2020-01-15,1,0,1,2704
1536,新课程改革背景下高职英语教学方法研究,盛爽,英语广场,2020-01-15,1,0,1,2704
1537,任务型教学在高职高专综合英语课堂的实践,孟向英,英语广场,2020-01-15,0,0,0,2704
1538,英语教学应根据信息化浪潮做出调整与突破,黄尚君,英语广场,2020-01-15,0,0,0,2704
1539,学习活动观引领下初中英语校本阅读教学策略,俞静芳,英语广场,2020-01-15,1,0,1,2704
1540,思维导图在高中英语阅读教学中的实践探究,许晓娟,英语广场,2020-01-15,3,0,3,2704
1541,过程教学法在高中英语写作教学中的应用,乔盼果,英语广场,2020-01-15,4,0,4,2704
1542,"巧用网络资源,活化初中英语阅读教学",陈丹萍,英语广场,2020-01-15,1,0,1,2704
1543,大学生英语课堂参与现状及解决策略――以重庆大学城市科技学院为例,张单；陈罗云,英语广场,2020-01-15,1,0,1,2704
1544,方框图教学法在英语口语教学中的应用初探,周尚同,英语广场,2020-01-15,0,0,0,2704
1545,模因论大学英语听说教学研讨,涂文娟,英语广场,2020-01-15,0,0,0,2704
1546,剑桥商务英语“小型演讲”在教学实践中的问题与改进措施探析,何勇,英语广场,2020-01-15,0,0,0,2704
1547,英语教学中以OBE为导向增强音乐专业学生的核心素养研究,孙晓波；张子奕,英语广场,2020-01-15,0,0,0,2704
1548,简析合作学习教学法在高职商务英语教学中的应用,刘燕青,英语广场,2020-01-15,0,0,0,2704
1549,基于SPOC的混合式大学英语听说课程教学模式设计,潘文晋,英语广场,2020-01-15,1,0,1,2704
1550,基于产出导向法的大学英语翻转课堂模式构建,常丹丹,英语广场,2020-01-15,0,0,0,2704
