序号,篇名,作者,刊名,发表时间,被引,自引,外引,文献总数
666,关于课程思政视角下高职英语教学改革分析研究,代芳丽,英语广场,2020-07-25,0,0,0,2704
667,商务英语教学中的社会与文化研究,姚坚,英语广场,2020-07-25,0,0,0,2704
668,基于学科核心素养的高中英语语法教学探究――以关系代词引导的定语从句教学为例,叶春莉； 常赛男,英语广场,2020-07-25,3,0,3,2704
669,基于英语学习活动观下初中英语阅读教学设计策略研究,邓雪琴,英语广场,2020-07-25,5,0,5,2704
670,素养教育在中职英语教学中的渗透,苏雪花,英语广场,2020-07-25,0,0,0,2704
671,基于“话题主线”的初中英语语法复习的实践与思考,朱慧,英语广场,2020-07-25,2,0,2,2704
672,来华留学生心理健康教育课程教学探析,刘伶俐,英语广场,2020-07-25,1,0,1,2704
673,基于产出导向法的对分课堂教学设计与实践――以《客舱服务英语》课为例,刘明霞,英语广场,2020-07-15,0,0,0,2704
674,论《看得见风景的房间》中译文与读者的连接,鄢佳,英语广场,2020-07-15,0,0,0,2704
675,从“三美论”探析许渊冲的经典唐诗译作,曹慧娴； 王心怡,英语广场,2020-07-15,0,0,0,2704
676,关联理论下李清照词句花之“瘦”的翻译美学解读,裴珊珊,英语广场,2020-07-15,0,0,0,2704
677,阐释运作理论视角下苏轼诗词英译分析――以许渊冲和华兹生的译本为例,万佳琦； 肖飞,英语广场,2020-07-15,3,0,3,2704
678,英美文学作品的语言运用及其关联性语境,王继红,英语广场,2020-07-15,0,0,0,2704
679,从消费主义视角分析《洪堡的礼物》中知识分子的精神困境和生存策略,薛陈敏； 张弛,英语广场,2020-07-15,7,0,7,2704
680,从《贫瘠的土地》看艾伦・格拉斯哥的女性观,陈丽屏； 韩启群,英语广场,2020-07-15,9,0,9,2704
681,浅析小说《罂粟海》中人物的归属感与身份认同危机,宋瑛,英语广场,2020-07-15,0,0,0,2704
682,荆棘中盛开的玫瑰――从创伤理论视角解读《献给艾米丽的一朵玫瑰》,邓阳,英语广场,2020-07-15,0,0,0,2704
683,A Comparison of Cultural Connotations of Animal Words between Chinese and English,邢永琛,英语广场,2020-07-15,0,0,0,2704
684,网络流行体的分类与分析,王宁； 潘丽霞,英语广场,2020-07-15,0,0,0,2704
685,基于来华留学生需求调查的中国文化教学探究――以西安高校留学生为例,李蕾,英语广场,2020-07-15,2,0,2,2704
686,从目的论视角看英汉翻译研究,傅思晴,英语广场,2020-07-15,0,0,0,2704
687,高职英语课程教学“文化育人”策略研究,黄小燕,英语广场,2020-07-15,0,0,0,2704
688,高职英语写作“线上线下”混合学习教学模式探究,王舒妤,英语广场,2020-07-15,1,0,1,2704
689,基于职业能力培养视角的高职英语教学模式改革研究,许丽莎,英语广场,2020-07-15,2,0,2,2704
690,高职院校商务英语专业口语教学改革研究,穆然,英语广场,2020-07-15,1,0,1,2704
691,基于SPOC的混合式教学模式建构与实践――以《跨文化交际》课程为例,李恒,英语广场,2020-07-15,1,0,1,2704
692,基于产出导向法的大学英语混合式教学模式探究,席磊； 田稷； 任今照,英语广场,2020-07-15,2,0,2,2704
693,微课在大学英语拓展课程中的应用与研究,王辉,英语广场,2020-07-15,0,0,0,2704
694,语用推理视角下大学英语听力理解的学习策略研究,陈甜； 王珏； 周冠玲,英语广场,2020-07-15,0,0,0,2704
695,基于CNKI的大学英语混合学习可视化研究分析,汤晓芳,英语广场,2020-07-15,0,0,0,2704
696,一流课程建设背景下的大学英语听说教学模式改革与实践――基于OBE理念视角,罗元梅,英语广场,2020-07-15,1,0,1,2704
697,“互联网+”时代下模因论的大学英语写作教学模式创新探讨,涂文娟,英语广场,2020-07-15,0,0,0,2704
698,双向传输教学模式下将中华文化融入高职职业英语教学的策略探讨,王友,英语广场,2020-07-15,0,0,0,2704
699,新形势下英语专业学生国际交流能力的培养策略研究,熊晓雪,英语广场,2020-07-15,0,0,0,2704
700,大数据时代的大学英语写作教学改革,马旭光,英语广场,2020-07-15,1,0,1,2704
701,信息化教学视角下高职英语教学改革的实施策略探究,赵亚军,英语广场,2020-07-15,1,0,1,2704
702,浸润于“生态给养”下的大学英语学习环境的设计原则,王娇,英语广场,2020-07-15,1,0,1,2704
703,后方法教学理论与中心论碰撞对ESP教学的观照,李春蕾,英语广场,2020-07-15,0,0,0,2704
704,浅谈初中英语教学设计,钱传蔷； 陈红梅,英语广场,2020-07-15,3,0,3,2704
705,示范性高中学生英语学业归因风格调查研究,廖飞,英语广场,2020-07-15,0,0,0,2704
706,在初中英语阅读教学中培养语用能力研究,刘金凤,英语广场,2020-07-15,3,0,3,2704
707,词类转译法在科技文本英汉翻译中的运用,宋燕； 熊立斌,英语广场,2020-07-15,2,0,2,2704
708,论政治文本中隐喻的英译策略,刘雅丽； 郑景婷,英语广场,2020-07-15,0,0,0,2704
709,旅游文本的文体特征与英译策略研究,孟容静,英语广场,2020-07-15,1,0,1,2704
710,吉尔模式指导下的涉外案件审讯口译策略,王铂钧； 邓建华,英语广场,2020-07-15,1,0,1,2704
711,英语翻译中跨文化视角转换及翻译技巧研究,孟丽丽,英语广场,2020-07-15,3,0,3,2704
712,国外英语教材插图性别表征研究,房艳,英语广场,2020-07-15,0,0,0,2704
713,基于语料库的不同语域报刊文章的词汇量化分析,吴景颐； 赵小东,英语广场,2020-07-15,0,0,0,2704
714,同伴互评模式在高职英语写作教学中的应用研究,陈瑞,英语广场,2020-07-15,0,0,0,2704
715,试论生态文化对日本社会发展的影响,陈爱琴,英语广场,2020-07-05,12,0,12,2704
716,论诗歌翻译中的形式问题,蔡欣洁,英语广场,2020-07-05,0,0,0,2704
717,托尼・莫里森小说《宠儿》中的宠儿对丹芙的反向引领研究,魏竹涵； 张军,英语广场,2020-07-05,1,0,1,2704
718,杰克・伦敦作品中的生态意识研究,张悦,英语广场,2020-07-05,1,0,1,2704
719,中西女性主义比较研究――以《雷雨》和《一小时的故事》为例,朱昀； 肖飞,英语广场,2020-07-05,6,0,6,2704
720,《美丽新世界》中莎士比亚戏剧情节的讽刺与启示意义,张]芸； 王旭霞,英语广场,2020-07-05,9,0,9,2704
721,《香水》中体现的存在主义解读,胡斐； 沈宸亦,英语广场,2020-07-05,12,3,9,2704
722,概念整合理论下对《红楼梦》中人名双关语的解读,陈卓彦； 田兴斌,英语广场,2020-07-05,1,0,1,2704
723,从宏观层面和微观层面谈英汉语言对比,贾信信,英语广场,2020-07-05,2,0,2,2704
724,基于微课的翻转课堂教学模式研究――以《翻译理论与实践》课为例,邝玉坤,英语广场,2020-07-05,0,0,0,2704
725,基于目的论视角下的手机游戏汉译英翻译研究――以《王者荣耀》为例,谈津雷； 杨玉,英语广场,2020-07-05,1,0,1,2704
726,译前准备与翻译语境化对汉译英质量的影响――以第二十八届韩素音青年翻译奖竞赛汉译英为例,刘潇,英语广场,2020-07-05,0,0,0,2704
727,生态翻译学视角下青城山导游词的英译研究,鲁纯； 刘艳,英语广场,2020-07-05,1,0,1,2704
728,衡阳特色民俗文化的外宣及其翻译策略研究,潘依婷,英语广场,2020-07-05,0,0,0,2704
729,近五年部分热词汉译英翻译研究,陈玉青； 王庆奖,英语广场,2020-07-05,0,0,0,2704
730,文化传播学视角下饮食文化翻译策略研究,梁琦,英语广场,2020-07-05,0,0,0,2704
731,“互联网+教育”背景下英语教学范式变革展望,姜辰娟,英语广场,2020-07-05,1,0,1,2704
732,浅谈英美影视作品对英语听说能力的影响,钱传蔷； 陈红梅,英语广场,2020-07-05,10,0,10,2704
733,基于语料库的中国高中生英语作文句法主从关系错误分析,徐雅南； 曾贤模,英语广场,2020-07-05,1,0,1,2704
734,基于ESP的电竞英语抛锚式教学模式探究,王一青,英语广场,2020-07-05,1,0,1,2704
735,新国标指导下应用型本科院校英语专业实践模式新探索,魏薇； 李雪婕,英语广场,2020-07-05,0,0,0,2704
736,中国英语教育的语言教学模式探析,程紫薇,英语广场,2020-07-05,0,0,0,2704
737,微媒体时代下民办高校英语教学改革,王志茹； 尹茜,英语广场,2020-07-05,0,0,0,2704
738,中国饮食文化在高职酒店英语教学中的融入及影响探究,陈军容,英语广场,2020-07-05,0,0,0,2704
739,大数据环境下提高大学生英语语法能力的现实境遇与路径选择,王永丽,英语广场,2020-07-05,2,0,2,2704
740,网络多模态环境下高职英语视听说教学模式探究,易衡,英语广场,2020-07-05,0,0,0,2704
741,基于设计思维的英语专业语言实践活动的设计与实现,郑润宇； 刘红江,英语广场,2020-07-05,0,0,0,2704
742,课程思政在高职英语教学中的实施策略探究,陈香香,英语广场,2020-07-05,1,0,1,2704
743,澳大利亚TESOL教学模式在我国高职英语教学中的应用研究,陈嘉如,英语广场,2020-07-05,1,0,1,2704
744,生态语言学视角下的英语词汇教学特性分析,周思莹； 祁文慧,英语广场,2020-07-05,5,0,5,2704
745,高校英语翻转课堂的教学分析,刘畅,英语广场,2020-07-05,1,0,1,2704
746,支架式教学模式在大学英语听说课堂中应用的有效性研究,杨敏,英语广场,2020-07-05,1,0,1,2704
747,基于翻转课堂的高职英语语法教学研究与实践,郭欣欣； 陈浩,英语广场,2020-07-05,2,0,2,2704
748,浅析高中英语三段七步读写整合教学模式,陈淑男,英语广场,2020-07-05,1,0,1,2704
749,丰富农村小学的英语课外阅读体验探析,吴云,英语广场,2020-07-05,0,0,0,2704
750,小学英语中自然拼读与绘本阅读相结合的策略分析,周缨汶,英语广场,2020-07-05,6,0,6,2704
185,英语委婉语的语用功能及其对跨文化交际的启示,张佳； 鲍志坤,英语广场,2020-11-15,16,0,16,2704
429,论沈从文《边城》中的生态叙事及其审美取向,陈桂霞,英语广场,2020-09-15,1,0,1,2704
751,“语法―语义―语用”三平面视阈下的《孟子》英译研究,肖涵；韦储学,英语广场,2020-07-05,0,0,0,2704
752,中国文化“走出去”视域下中国文化典籍翻译――以《论语》英译为例,邓凯月；鲍志坤,英语广场,2020-07-05,17,0,17,2704
753,中外合作办学内部质量保障协同平台构建探索――以南京信息工程大学雷丁学院为例,张雅淇；赵燕,英语广场,2020-07-05,0,0,0,2704
754,智慧教育生态学视角下高职“汽车专业英语”课程教学优化,何辉,英语广场,2020-06-25,1,0,1,2704
755,中职医护英语“对分课堂”线上教学模式探索,洪晓旋,英语广场,2020-06-25,0,0,0,2704
756,英语文学作品人物命名的文化内涵探究,陈建仙,英语广场,2020-06-25,1,0,1,2704
757,男性气质视角下《奥兰多》作品窥探,周红燕,英语广场,2020-06-25,0,0,0,2704
758,屈服的斗士――浅析《简・爱》新女性形象的矛盾性和局限性,罗浩瀚,英语广场,2020-06-25,0,0,0,2704
759,浅析外事活动中口译员综合能力,董书涵；陈香若,英语广场,2020-06-25,0,0,0,2704
760,南昌市4A旅游景区外语使用情况――以洪崖丹井景区为例,唐昭梅,英语广场,2020-06-25,0,0,0,2704
761,基于教育理论的口译教学模式研究,栗文达,英语广场,2020-06-25,1,0,1,2704
762,从翻译实践出发的译者身份多重性探究,孙茜,英语广场,2020-06-25,1,0,1,2704
763,翻译教学中的隐喻翻译认知策略及运用研究,邓恋玫；王德易,英语广场,2020-06-25,0,0,0,2704
764,外语信息化教学模式与教师职业发展研究,徐敏,英语广场,2020-06-25,0,0,0,2704
765,商务英语翻译教学与课程思政融合的探索与实践,赵晶晶；王h,英语广场,2020-06-25,5,0,5,2704
766,英语词义变化探微,郭子佩,英语广场,2020-06-25,0,0,0,2704
767,大学英语教材课文高频词与学术词词汇量实证研究――以《大学英语精读》为例,周俊敏,英语广场,2020-06-25,0,0,0,2704
768,“互联网+”背景下大学英语教学模式探究,张倩,英语广场,2020-06-25,0,0,0,2704
769,五段式英语写作教学法的反思和发展,王子晗,英语广场,2020-06-25,0,0,0,2704
770,边境地区高职院校学前教育幼儿英语教学改革与实践研究,邓肖丽；谢娜；李霞；黄秀月,英语广场,2020-06-25,4,0,4,2704
771,英语专业课程思政教学实践探析,曹鸿娟,英语广场,2020-06-25,0,0,0,2704
772,高职英语基础教学思政元素融入的探究,杜文彬,英语广场,2020-06-25,1,0,1,2704
773,基于深度阅读的高职英语阅读教学策略浅析,金义芬,英语广场,2020-06-25,3,0,3,2704
774,融入地方传统文化的大学英语教学探究――以河南传统文化为例,王欢,英语广场,2020-06-25,2,0,2,2704
775,文化导向型教学模式与高职高专英语教学的有效融合分析,张辉,英语广场,2020-06-25,0,0,0,2704
776,西南边疆少数民族地区大学英语“课程思政”路径研究,早李D；张德敬；黄坚亮,英语广场,2020-06-25,0,0,0,2704
777,信息化背景下混合式教学在林业类高职院校英语口语教学中的运用,王文婧,英语广场,2020-06-25,0,0,0,2704
778,非英语专业大学英语课程应用雨课堂工具必要性初探,田丹丹；杨晶华,英语广场,2020-06-25,1,0,1,2704
779,新时代中国传统文化融入高职英语教学的可行性研究,张媛媛,英语广场,2020-06-25,4,0,4,2704
780,合作学习在大学英语教学中的应用及优化策略,刘微,英语广场,2020-06-25,2,0,2,2704
781,英语歌曲学唱与听力技能提高研究,洪展展,英语广场,2020-06-25,0,0,0,2704
782,在线学习平台在大学英语个性化移动学习中的应用――以U校园为例,刘惟绰,英语广场,2020-06-25,1,0,1,2704
783,基于高中艺术生英语学习的特点进行高中英语词汇教学的有效途径,李媛媛,英语广场,2020-06-25,4,0,4,2704
784,中职英语教学职业化的体现方法,郝彬彬；黄馨文,英语广场,2020-06-25,1,0,1,2704
785,浅谈英语学科网络教学的优势,王伟艺,英语广场,2020-06-25,0,0,0,2704
786,任务型教学法在初中英语阅读教学中的应用探讨――以外研版九年级下册Module 2 Unit 2 What do I like best about school？教学为例,生彤彤,英语广场,2020-06-25,5,0,5,2704
787,信息化背景下中职英语课堂德育渗透初探,金宁菊,英语广场,2020-06-25,2,0,2,2704
788,初中英语文化意识培养的有效策略,朱建萍,英语广场,2020-06-25,1,0,1,2704
789,高中英语批判性阅读教学中学生批判性思维能力培养的研究,张利敏,英语广场,2020-06-25,5,0,5,2704
790,农村高中学生英语听说能力培养策略探究,杜小兰,英语广场,2020-06-25,0,0,0,2704
791,巧用“5S视听英语动画模式”培养中考英语听力能力――浅谈福建省中考视角下的初中英语听力教学实践研究,何蓓蓓,英语广场,2020-06-25,1,0,1,2704
792,应用于中职英语教学的汉英诗词歌曲欣赏,姚坚,英语广场,2020-06-25,0,0,0,2704
793,对比语言学视阈下英汉拟声词认知与翻译研究,刘泓言,英语广场,2020-06-25,0,0,0,2704
794,非物质文化遗产岭南粤剧英译研究现状分析,陈宇,英语广场,2020-06-25,2,0,2,2704
795,基于产出导向法的商务笔译课堂教学探索,李丹,英语广场,2020-06-25,2,0,2,2704
796,应用型本科院校“职业英语”课程建设研究,蒋景东,英语广场,2020-06-25,0,0,0,2704
797,浅析儿童文学翻译策略――以《哈利・波特与阿兹卡班的囚徒》两个中文译本为例,任丽洁；张军,英语广场,2020-06-15,1,0,1,2704
798,觉醒的女性――论《莳萝泡菜》中薇拉的人物塑造,朱蕾；王旭霞,英语广场,2020-06-15,11,0,11,2704
799,生态文学视角下《寂静的春天》和《复合污染》的对比,陈伊甸；陈爱琴,英语广场,2020-06-15,14,0,14,2704
800,荣格人格理论视角下解读《厄舍府的倒塌》,张祝徽徘梢,英语广场,2020-06-15,0,0,0,2704
801,荣格原型理论视角下《阿拉比》中的女性意象,周秋宇,英语广场,2020-06-15,0,0,0,2704
802,从小说《绳》看凯瑟琳・安・波特的婚恋观,陈琼琼,英语广场,2020-06-15,0,0,0,2704
803,创伤理论视角下《继承失落的人》的创伤分析,李安琪,英语广场,2020-06-15,0,0,0,2704
804,《红楼梦》中“气”的隐喻构建,陈虹羽,英语广场,2020-06-15,0,0,0,2704
805,政治文本汉英句型结构对比分析,夏；肖飞,英语广场,2020-06-15,6,0,6,2704
806,浅析人工智能对英语阅读学习者的影响,马悦,英语广场,2020-06-15,0,0,0,2704
807,旅游景点英文介绍中的错译现象研究――以莒县浮来山景区为例,温红蕾；于敏；蒋亚楠,英语广场,2020-06-15,0,0,0,2704
808,交际翻译理论下国家高新区政府网站外宣翻译问题探讨――以杭州市滨江区人民政府官网为例,傅雪婷,英语广场,2020-06-15,0,0,0,2704
809,《论语》中“仁”的翻译对比研究,储鑫,英语广场,2020-06-15,0,0,0,2704
810,从生态翻译学视角看环境科学类科普文的翻译策略,王心媛；陶李春,英语广场,2020-06-15,0,0,0,2704
811,多模态视域下基于“雨课堂”的《英语演讲》智慧教学模式建构,李筠,英语广场,2020-06-15,1,0,1,2704
812,网络环境下高校英语翻译教学模式思考,郝璐,英语广场,2020-06-15,1,0,1,2704
813,基于产出导向法的独立学院英语口译教学探索,余珊,英语广场,2020-06-15,0,0,0,2704
814,浅谈新时代对外宣传翻译与大学英语教学,张倩；李悦；孙洁琼,英语广场,2020-06-15,0,0,0,2704
815,长三角区域一体化高职英语教学改革研究,王玮；贾斌,英语广场,2020-06-15,0,0,0,2704
816,英语视听说“四位一体”课堂教学模式初探,董晓燕,英语广场,2020-06-15,0,0,0,2704
817,基于ARCS模型的英语听力APP对大学生学习动力激发的研究,庄筱钰；刘璐,英语广场,2020-06-15,1,0,1,2704
818,基于“互联网+”的大学英语混合式教学改革与实践,李晓媛,英语广场,2020-06-15,2,0,2,2704
819,“互联网+对分”课堂对学生思辨能力的培养――以综合英语课程为例,张淑红,英语广场,2020-06-15,2,0,2,2704
820,“互联网+”时代翻转课堂在本科翻译教学中的应用,张兵兵,英语广场,2020-06-15,0,0,0,2704
821,粤港澳大湾区建设背景下高职商务英语专业学生跨文化交际能力培养的策略探索,鲁燕,英语广场,2020-06-15,1,0,1,2704
822,人才培养模式下大学英语教学思辨能力的培养探讨,兰晶,英语广场,2020-06-15,1,0,1,2704
823,谈中国传统文化在高校英语教学中的导入,张璐,英语广场,2020-06-15,0,0,0,2704
824,师生共建大学英语课堂内外教学模式与实践研究,周逸轩,英语广场,2020-06-15,1,0,1,2704
825,形态学指导下的英语专业词汇教学初探,徐峥；祁文慧,英语广场,2020-06-15,2,0,2,2704
826,基于三语习得理论浅析逆向负迁移对英语写作的影响――以低年级西班牙语学生为例,邢文瑜,英语广场,2020-06-15,1,0,1,2704
827,基于微课的翻转课堂教学模式在初中英语听力教学中的应用――以《新概念英语2》为例,薛锦；邵华,英语广场,2020-06-15,9,0,9,2704
828,论语料库语言学在商务英语教学中的应用,李静欣,英语广场,2020-06-15,0,0,0,2704
829,高职学前英语教育课程体系研究与实践分析,李娅,英语广场,2020-06-15,0,0,0,2704
830,思维导图教学模式对非英语专业学生写作态度的积极影响,甘霖,英语广场,2020-06-15,1,0,1,2704
831,中华优秀传统文化融入大学英语课堂问题探究,张晶莹,英语广场,2020-06-15,2,0,2,2704
832,分层教学在大学英语教学实践中的运用策略探析,王秋丽,英语广场,2020-06-15,1,0,1,2704
833,深度学习视角下高中英语阅读教学设计,何敏琪,英语广场,2020-06-15,4,0,4,2704
834,文本类型理论视角下塑料挤出机械企业外宣英译,王浩炜；任朝迎,英语广场,2020-06-15,0,0,0,2704
835,中国英文医学期刊论文的语言质量分析――一项基于语料库的研究,高偌晗；王燕,英语广场,2020-06-15,0,0,0,2704
836,多模态隐喻视角下国产动画电影研究,单新荣,英语广场,2020-06-15,0,0,0,2704
837,情境教学在高职涉外护理英语口语教学中的应用,苗畅,英语广场,2020-06-05,2,0,2,2704
838,生态翻译视角下的《相见欢》英译本分析,王倩；韩启群,英语广场,2020-06-05,14,0,14,2704
839,从尤金・奈达的功能对等理论看《呐喊》的英译本,钱传蔷；陈红梅,英语广场,2020-06-05,6,0,6,2704
840,从接受美学角度看儿童文学的翻译――以《了不起的狐狸爸爸》为例,王_；费红,英语广场,2020-06-05,1,0,1,2704
841,他者的自我炒作――论王尔德的悲剧,李小蕾；刘常轩,英语广场,2020-06-05,0,0,0,2704
842,从空间批评理论看《幸存者回忆录》中艾米莉的成长,马瑾；张弛,英语广场,2020-06-05,9,0,9,2704
843,从人格结构理论视域解读《水孩子》,杨奥；徐莹莹,英语广场,2020-06-05,0,0,0,2704
844,国内语料库翻译研究现状及未来走向探讨,何丽玲,英语广场,2020-06-05,0,0,0,2704
845,文化差异视角下的英汉动物习语分析,钱丽彦；祁文慧,英语广场,2020-06-05,9,0,9,2704
846,基于手机APP的大学英语翻转课堂教学设计探究,王飞燕；李B,英语广场,2020-06-05,1,0,1,2704
847,电影《水形物语》中的修辞手法研究,左媛媛,英语广场,2020-06-05,0,0,0,2704
848,小学英语教学中巧妙运用角色扮演教学模式研究,李昱,英语广场,2020-06-05,4,0,4,2704
849,基于U校园教学平台的农业院校大学英语混合式教学模式探究,陈俐澜；车文娟,英语广场,2020-06-05,2,0,2,2704
850,跨文化交际语境下科技产品广告汉译的顺应性研究,赵一霏；张弛,英语广场,2020-06-05,19,0,19,2704
851,中国英语和中式英语关系再研究,杨喜刚,英语广场,2020-06-05,11,0,11,2704
852,二语词汇学习策略中学生认知与实践差异的元分析研究,王裕森；侯丽梅,英语广场,2020-06-05,0,0,0,2704
853,地方高校英语专业应用型翻译人才培养探究,阮红波；朱文凯；詹彩霞,英语广场,2020-06-05,1,0,1,2704
854,浅析慕课平台Coursera对于大学外语教学的启示作用,王慧；孙逢明；刘胜杰,英语广场,2020-06-05,1,0,1,2704
855,英语专业本科生翻译实践能力调查分析,周莉,英语广场,2020-06-05,18,4,14,2704
856,“一带一路”倡议下高职院校物流英语教学改革探析,戴丽娟,英语广场,2020-06-05,0,0,0,2704
857,大学英语课程中思政元素探析――以《新起点大学英语综合教程》为例,幸郁芊,英语广场,2020-06-05,2,0,2,2704
858,大学英语实施课程思政的实践与反思,赵爱青,英语广场,2020-06-05,0,0,0,2704
859,区域文化英语课程建设探究,杨丽娟,英语广场,2020-06-05,0,0,0,2704
860,网络视域下中学英语核心素养教学的研究与探索,陈淑花,英语广场,2020-06-05,0,0,0,2704
861,学科核心素养下的初中英语阅读教学优化设计,李渌秋,英语广场,2020-06-05,7,0,7,2704
862,提高英语课堂跨文化交际能力的有效途径――以口语为例,黄国荣,英语广场,2020-06-05,0,0,0,2704
863,交际翻译理论指导下的国内旅游景点官方网站中英翻译研究――以南京牛首山官方网站英文版为例,潘云天；肖飞,英语广场,2020-06-05,5,0,5,2704
864,系统功能视角下英语关系小句的评价功能研究,陆礼春,英语广场,2020-06-05,0,0,0,2704
865,浅析功能对等翻译理论视阈下四川方言的英译,张t帆；杨燕,英语广场,2020-06-05,1,0,1,2704
866,高校英语阅读教学文化语境建构策略,卜菀萌,英语广场,2020-06-05,0,0,0,2704
867,应用型本科生大学英语学习状况的调查与分析――以南通理工学院为例,袁敏敏；张元元,英语广场,2020-06-05,0,0,0,2704
868,大学生英语写作教学中读者意识培养的现状及对策,钱龙；刘凌,英语广场,2020-06-05,0,0,0,2704
869,中国文化失语症给高职英语课堂互动带来的障碍及解决对策,刘彬,英语广场,2020-06-05,0,0,0,2704
870,市场需求下大学英语选修课课程设置探索――以四川工商学院为例,王一,英语广场,2020-06-05,0,0,0,2704
871,功能对等理论指导下地理信息工程类科技论文的汉英翻译,宋燕；付瑛群；王帅琪；王红溪,英语广场,2020-06-05,0,0,0,2704
872,《致命女人》中探戈的艺术隐喻解读,沐永华；周炳鑫,英语广场,2020-06-05,2,0,2,2704
873,中日之于“白色”心理反应对比研究,简媛；孙景妤；韩树贤；张明晶,英语广场,2020-06-05,5,0,5,2704
874,跨文化身份构建――基于霍米・巴巴的混杂理论,王李霞,英语广场,2020-06-05,2,0,2,2704
875,认知语言学中的“隐喻”在新闻标题中的使用,吴继娟,英语广场,2020-06-05,0,0,0,2704
876,从翻译美学视域看文学翻译的审美再现――以《白鲸》汉译本为例,徐一灿,英语广场,2020-05-25,1,0,1,2704
877,卞之琳的散文译文风格研究,周建川,英语广场,2020-05-25,0,0,0,2704
878,《吾兄杰克》译者序,郭著章,英语广场,2020-05-25,0,0,0,2704
879,项目管理在翻译中的运用――以昆明理工大学局部解剖与手术学慕课翻译项目管理为例,杜蕊,英语广场,2020-05-25,0,0,0,2704
880,试论英汉委婉语的文化差异,赵芬艳,英语广场,2020-05-25,0,0,0,2704
881,探索分层教学在初中英语阅读课堂的运用,纪红,英语广场,2020-05-25,3,0,3,2704
